{"schemaVersion":"1.0","sourceEventId":"evt-missing-memory","contentId":"content-new-copy","version":1,"sourceLocale":"en-US","title":"New copy","brandVersion":1,"targetLocales":["fa-IR"],"formats":["localized_article"],"segments":[{"segmentId":"seg-new","kind":"body","text":"This sentence is not in the approved memory."}],"evidenceBoundary":"simulated","requestedBy":"failure-fixture"}
