{"schemaVersion":"1.0","sourceEventId":"evt-localize-008","contentId":"content-reliable-automation","version":1,"sourceLocale":"en-US","title":"Evidence-first automation","brandVersion":1,"targetLocales":["fa-IR","es-ES"],"formats":["localized_article","social_post","email","subtitles_srt","carousel_copy"],"segments":[{"segmentId":"seg-1","kind":"headline","text":"Reliable automation needs evidence.","startMs":0,"endMs":2800},{"segmentId":"seg-2","kind":"body","text":"Use versioned content and human review.","startMs":3000,"endMs":6500},{"segmentId":"seg-3","kind":"cta","text":"Read the implementation guide.","startMs":6800,"endMs":9500}],"evidenceBoundary":"simulated","requestedBy":"portfolio-fixture"}
